{
  "protocol_version": "1.0",
  "name": "preset_occultation",
  "loop": 1,
  "nodes": [
    {
      "id": "occ_trial",
      "type": "occultation",
      "engine": "pygame",
      "params": {
        "occultation_time": 1.5,
        "ball_speed": 100,
        "total_movement_time": 2.0,
        "variation": 0.0,
        "circle_option": 0,
        "max_duration_s": 10
      }
    }
  ]
}
